{"schema_version":"foigent.integration-control.release.v1","canonicalization":"foigent.integration-control.canonical-json.v1","version":"v0.1.0-candidate.1","source_commit":"12f1ede8ae85e9d311a8150694eea54ff6f02950","source_tree":"e6945fa071afd6a0b9317d3ec862cbcbf47a0154","go_version":"go1.25.0","toolchain":"go1.25.12","contracts_sha256":"sha256:a3697170a39aa97f81d690e2532b19383d1f77eb7b59c3273e37a3f04b24e186","valid_fixtures_sha256":"sha256:a5df1bc8c42f01d71f41c2dd6706994549920573a448d95e699fff9d39b2fa46","invalid_fixtures_sha256":"sha256:850df4fb845acc40770cb98fd6d6c9638599dba30955e3efd4b899dbc9fcfad8","artifacts":[{"path":"dist/foigent-integration-control-v0.1.0-candidate.1-darwin-arm64","os":"darwin","architecture":"arm64","size_bytes":4034066,"sha256":"sha256:ba574ac25abd063914d785a34d097b14a1cf09021a953c40803414900c1f3dc1"},{"path":"dist/foigent-integration-control-v0.1.0-candidate.1-linux-amd64","os":"linux","architecture":"amd64","size_bytes":4132939,"sha256":"sha256:b37a9b92ef237844327911b9a4b1a1266b2970f3acbc50de428aa7d518a1fbb8"},{"path":"dist/foigent-integration-control-v0.1.0-candidate.1-source.tar","os":"source","architecture":"source","size_bytes":235520,"sha256":"sha256:360cbc70cbbe84361c23e9f89f3aeed2689b235197b2ebcb7b436187c9aedfef"}],"double_build_equal":true,"capability_boundary":"offline_files_only","gates":[{"name":"capability_boundary","status":"pass"},{"name":"contract_fixture_digest_revalidation","status":"pass"},{"name":"double_build","status":"pass"},{"name":"full_n1","status":"pass"},{"name":"git_fsck","status":"pass"},{"name":"go_test","status":"pass"},{"name":"go_test_race","status":"pass"},{"name":"go_vet","status":"pass"},{"name":"no_private_or_sensitive_material","status":"pass"},{"name":"no_remote","status":"pass"},{"name":"schema_drift","status":"pass"},{"name":"source_archive_exact_commit","status":"pass"},{"name":"whole_preauthorization_verify","status":"pass"}],"effects":{"target_access":0,"product_repository_edit":0,"product_db_or_api_access":0,"credential_or_key_access":0,"worker_or_traffic":0}}